{
  "$schema": "https://json-schema.org/draft/2020-12/schema",
  "$id": "https://orchestra.dev/schemas/dream/policy-v1.json",
  "title": "orchestra.exploration-policy.v1",
  "description": "Declarative deterministic exploration policy specification",
  "type": "object",
  "required": [
    "schema",
    "policy_id",
    "rules"
  ],
  "properties": {
    "schema": {
      "type": "string",
      "const": "orchestra.exploration-policy.v1"
    },
    "policy_id": {
      "type": "string",
      "pattern": "^policy-[a-f0-9]{64}$"
    },
    "base_policy": {
      "type": ["string", "null"]
    },
    "description": {
      "type": "string"
    },
    "created_at": {
      "type": "string"
    },
    "rules": {
      "type": "array",
      "maxItems": 128,
      "items": {
        "type": "object",
        "required": [
          "id",
          "decision_type",
          "priority",
          "when",
          "choose"
        ],
        "properties": {
          "id": {
            "type": "string"
          },
          "decision_type": {
            "type": "string",
            "enum": [
              "WORKER_TIER",
              "INVESTIGATION_STRATEGY",
              "RETRY_ACTION"
            ]
          },
          "priority": {
            "type": "integer"
          },
          "when": {
            "type": "object",
            "properties": {
              "task_action": {
                "type": "array",
                "minItems": 1,
                "items": {
                  "type": "string",
                  "enum": [
                    "ORCHESTRATE",
                    "INVESTIGATE",
                    "IMPLEMENT",
                    "TEST",
                    "REVIEW",
                    "MECHANICAL_FIX",
                    "INTEGRATE",
                    "ESCALATE",
                    "HEAVY_EXECUTION",
                    "DIRECT_ACTION"
                  ]
                }
              },
              "task_domain": {
                "type": "array",
                "minItems": 1,
                "items": {
                  "type": "string",
                  "enum": [
                    "CODE",
                    "AUTOEQ_ALGORITHM",
                    "DSP_CORE",
                    "UI",
                    "DATA",
                    "INFRA",
                    "TESTING",
                    "DOCS",
                    "RESEARCH",
                    "ORCHESTRA",
                    "GENERAL"
                  ]
                }
              },
              "criticality": {
                "type": "array",
                "minItems": 1,
                "items": {
                  "type": "string",
                  "enum": [
                    "NORMAL",
                    "MAJOR",
                    "CRITICAL"
                  ]
                }
              },
              "complexity": {
                "type": "array",
                "minItems": 1,
                "items": {
                  "type": "string",
                  "enum": [
                    "SIMPLE",
                    "NORMAL",
                    "DIFFICULT",
                    "EXPERIMENTAL",
                    "MECHANICAL",
                    "INTEGRATION"
                  ]
                }
              },
              "state": {
                "type": "array",
                "minItems": 1,
                "items": {
                  "type": "string",
                  "enum": [
                    "INTAKE",
                    "CLASSIFIED",
                    "DIRECT_ACTION",
                    "PLANNED",
                    "DELEGATED",
                    "EXECUTING",
                    "EVIDENCE_READY",
                    "ACCEPTANCE",
                    "INTEGRATING",
                    "DONE",
                    "BLOCKED",
                    "HUMAN_GATE",
                    "CRITICAL_REVIEW",
                    "PLANNING"
                  ]
                }
              },
              "attempt": {
                "oneOf": [
                  {
                    "type": "object",
                    "required": ["min", "max"],
                    "properties": {
                      "min": { "type": "integer", "minimum": 0 },
                      "max": { "type": "integer", "minimum": 0 }
                    },
                    "additionalProperties": false
                  },
                  {
                    "type": "array",
                    "minItems": 1,
                    "items": { "type": "integer", "minimum": 0 }
                  },
                  {
                    "type": "integer",
                    "minimum": 0
                  }
                ]
              },
              "retry_remaining": {
                "oneOf": [
                  {
                    "type": "object",
                    "required": ["min", "max"],
                    "properties": {
                      "min": { "type": "integer", "minimum": 0 },
                      "max": { "type": "integer", "minimum": 0 }
                    },
                    "additionalProperties": false
                  },
                  {
                    "type": "array",
                    "minItems": 1,
                    "items": { "type": "integer", "minimum": 0 }
                  },
                  {
                    "type": "integer",
                    "minimum": 0
                  }
                ]
              },
              "retry_reason": {
                "type": "array",
                "minItems": 1,
                "items": {
                  "type": "string",
                  "enum": [
                    "MISINTERPRETED_REQUIREMENT",
                    "INCOMPLETE_IMPLEMENTATION",
                    "FAILED_TEST",
                    "SCOPE_GAP",
                    "MISSING_CONTEXT",
                    "INTEGRATION_FAILURE"
                  ]
                }
              },
              "post_investigation": {
                "type": "boolean"
              },
              "evidence": {
                "type": "object",
                "properties": {
                  "tests": {
                    "type": "array",
                    "minItems": 1,
                    "items": { "type": "string", "enum": ["PASS", "FAIL", "UNKNOWN"] }
                  },
                  "typecheck": {
                    "type": "array",
                    "minItems": 1,
                    "items": { "type": "string", "enum": ["PASS", "FAIL", "UNKNOWN", "NOT_REQUIRED"] }
                  },
                  "build": {
                    "type": "array",
                    "minItems": 1,
                    "items": { "type": "string", "enum": ["PASS", "FAIL", "UNKNOWN", "NOT_REQUIRED"] }
                  },
                  "scope_check": {
                    "type": "array",
                    "minItems": 1,
                    "items": { "type": "string", "enum": ["PASS", "FAIL", "UNKNOWN"] }
                  },
                  "validation_fresh": {
                    "type": "boolean"
                  }
                },
                "additionalProperties": false
              }
            },
            "additionalProperties": false
          },
          "choose": {
            "type": "string"
          },
          "description": {
            "type": "string"
          }
        },
        "allOf": [
          {
            "if": {
              "properties": { "decision_type": { "const": "WORKER_TIER" } }
            },
            "then": {
              "properties": {
                "choose": {
                  "type": "string",
                  "enum": [
                    "FLASH_LOW",
                    "FLASH_MEDIUM",
                    "FLASH_HIGH"
                  ]
                }
              }
            }
          },
          {
            "if": {
              "properties": { "decision_type": { "const": "INVESTIGATION_STRATEGY" } }
            },
            "then": {
              "properties": {
                "choose": {
                  "type": "string",
                  "enum": [
                    "IMPLEMENT_DIRECT",
                    "INVESTIGATE_FIRST"
                  ]
                }
              }
            }
          },
          {
            "if": {
              "properties": { "decision_type": { "const": "RETRY_ACTION" } }
            },
            "then": {
              "properties": {
                "choose": {
                  "type": "string",
                  "enum": [
                    "RETRY_SAME",
                    "ESCALATE_WORKER",
                    "INVESTIGATE_FIRST",
                    "REPLAN"
                  ]
                }
              }
            }
          }
        ],
        "additionalProperties": false
      }
    }
  },
  "additionalProperties": false
}
